{
  "schemaVersion": "1.0",
  "project": "sibylhub",
  "mode": "declarative",
  "runtimeOwners": {
    "runtime-typescript": "workspace"
  },
  "safeCommands": [
    "sibyl check --json"
  ],
  "manifestEvidence": [
    {
      "path": "package.json",
      "kind": "package-manifest",
      "languageId": "typescript",
      "runtimeId": "runtime-typescript",
      "packageManagerId": "package-manager-typescript",
      "lockfileId": "lockfile-typescript"
    }
  ],
  "invariantIds": [
    "invariant-typescript"
  ],
  "remoteMutationRequiresExplicitCommand": true,
  "remoteEvidenceIsSeparate": true
}
